{
  "schema_version": "2.0",
  "id": "ORG-007",
  "title": "Build canonical organization vendor services",
  "status": "blocked",
  "priority": "P2",
  "owner_agent": "organization",
  "created_at": "2026-09-23T19:16:12.444Z",
  "updated_at": "2026-09-27T19:59:08.554Z",
  "base_sha": "d21769046d517898144ee09a1c7bb4a7d36b068f",
  "working_tree_status": "dirty (30 entries)",
  "goal": "Replace mock or local-only vendor behavior with persistent organization-scoped contracts after DB-012.",
  "scope": {
    "in": [],
    "out": []
  },
  "working_set": [
    "lib/organization/vendors/**",
    "app/api/orgs/**",
    "__tests__/organization/**"
  ],
  "references": [
    "docs/DEVELOPMENT_WORKFLOW.md"
  ],
  "acceptance_criteria": [
    {
      "id": "AC-1",
      "criterion": "Replace mock or local-only vendor behavior with persistent organization-scoped contracts after DB-012.",
      "owner": "organization",
      "state": "not_started",
      "evidence": []
    }
  ],
  "verification": {
    "tier": "fast",
    "gates": [
      {
        "id": "local",
        "level": "local",
        "owner": "organization",
        "required_for": "task",
        "result": "not_run",
        "commands": [],
        "evidence": [],
        "last_run_sha": null,
        "last_run_at": null
      }
    ]
  },
  "progress": {
    "summary": "Created; implementation not started.",
    "completed": [],
    "next_steps": [
      "The task is selected as the owner's next collision-free work item."
    ],
    "blockers": [],
    "checkpoints": []
  },
  "handoffs": [],
  "execution_state": "waiting_dependency",
  "outcome_id": "POSTLAUNCH-LOGISTICS",
  "deliverable_class": "contract",
  "decision_owner": "organization",
  "shared_working_set": [],
  "depends_on": [
    "DB-012"
  ],
  "resume_condition": "The task is selected as the owner's next collision-free work item.",
  "blocked_on": [
    {
      "type": "dependency",
      "owner": "organization",
      "condition": "The task is selected as the owner's next collision-free work item.",
      "dependency_task_ids": [
        "DB-012"
      ]
    }
  ]
}
