{
  "schema_version": "2.0",
  "id": "ADMIN-011",
  "title": "Repair Logistics site-map builder launch",
  "status": "completed",
  "priority": "P2",
  "owner_agent": "admin",
  "created_at": "2026-09-24T01:01:51.680Z",
  "updated_at": "2026-09-27T19:59:08.554Z",
  "base_sha": "d21769046d517898144ee09a1c7bb4a7d36b068f",
  "working_tree_status": "dirty (112 entries)",
  "goal": "Make authenticated event/tour-scoped site-map creation reliably open the builder under the selected acting organization.",
  "scope": {
    "in": [
      "Admin Logistics and event entry points that read or mutate site maps",
      "Acting-organization request propagation for JSON and multipart operations",
      "Create-response-to-builder state handoff and event/tour scope changes",
      "Authorized site-map collection writes for organization owners",
      "Canonical Admin Maps deep links and focused regression coverage"
    ],
    "out": [
      "Database migrations or authorization relaxation",
      "Venue, artist, public, and Work Mode site-map surfaces",
      "Unrelated Logistics or Admin dashboard changes"
    ]
  },
  "working_set": [
    "components/admin/logistics/site-map/site-map-manager.tsx",
    "components/admin/logistics/site-map/site-map-create-sheet.tsx",
    "hooks/use-site-maps.ts",
    "app/api/admin/logistics/site-maps/route.ts",
    "lib/admin/admin-ops-context.ts",
    "__tests__/admin/site-map-builder-launch.test.tsx",
    "__tests__/admin/site-map-collection-route.test.ts",
    "__tests__/logistics/logistics-route-contract.test.ts"
  ],
  "references": [
    "docs/DEVELOPMENT_WORKFLOW.md"
  ],
  "acceptance_criteria": [
    {
      "id": "AC-1",
      "criterion": "Admin site-map reads and mutations carry the explicitly selected acting organization.",
      "owner": "admin",
      "state": "met",
      "evidence": []
    },
    {
      "id": "AC-2",
      "criterion": "A successful create response mounts the full-screen builder without depending on a list refresh.",
      "owner": "admin",
      "state": "met",
      "evidence": []
    },
    {
      "id": "AC-3",
      "criterion": "Stale list, detail, or scope responses cannot close or reopen a map under the wrong event or tour.",
      "owner": "admin",
      "state": "met",
      "evidence": []
    },
    {
      "id": "AC-4",
      "criterion": "Organization-owner creation writes only after server-side organization and event/tour scope validation.",
      "owner": "admin",
      "state": "met",
      "evidence": []
    },
    {
      "id": "AC-5",
      "criterion": "Failures are shown inside the wizard and never leave an indefinite opening overlay.",
      "owner": "admin",
      "state": "met",
      "evidence": []
    },
    {
      "id": "AC-6",
      "criterion": "Canonical links use tab=maps and retain eventId, tourId, and optional siteMapId.",
      "owner": "admin",
      "state": "met",
      "evidence": []
    },
    {
      "id": "AC-7",
      "criterion": "Focused component, route, scope, authorization, contract, lint, and control-plane checks pass.",
      "owner": "admin",
      "state": "met",
      "evidence": []
    }
  ],
  "verification": {
    "tier": "feature",
    "gates": [
      {
        "id": "local",
        "level": "local",
        "owner": "admin",
        "required_for": "task",
        "result": "pass",
        "commands": [
          "npx vitest run __tests__/admin/site-map-collection-route.test.ts __tests__/admin/site-map-builder-launch.test.tsx __tests__/admin/admin-acting-request.test.tsx __tests__/admin/logistics-scope.test.ts __tests__/admin/event-ops-context.test.ts __tests__/admin/event-tour-production-hardening.test.ts __tests__/admin/site-map-acting-org-access.test.ts __tests__/logistics/logistics-route-contract.test.ts",
          "npx eslint app/api/admin/logistics/site-maps/route.ts components/admin/logistics/site-map/site-map-manager.tsx components/admin/logistics/site-map/site-map-create-sheet.tsx components/admin/logistics/vendor-management.tsx components/admin/event-communication-hub.tsx app/admin/dashboard/events/[id]/day-sheet/page.tsx hooks/use-site-maps.ts lib/admin/admin-ops-context.ts __tests__/admin/site-map-builder-launch.test.tsx __tests__/admin/site-map-collection-route.test.ts __tests__/admin/event-ops-context.test.ts __tests__/admin/event-tour-production-hardening.test.ts __tests__/logistics/logistics-route-contract.test.ts",
          "npm run check:admin-route-registry",
          "npm run verify:fast -- --changed",
          "npm run typecheck",
          "npm run agents:validate"
        ],
        "evidence": [
          "Focused Vitest verification passed: 8 files, 54 tests, including successful owner creation, stale-list survival, event/tour/combined scopes, multipart upload headers, denied creation, missing acting organization, deep links, and scope-change cleanup.",
          "Focused ESLint completed with no findings across all touched implementation and test files.",
          "Admin route registry check passed: 291 route files, 54/54 legacy classifications, exact route-method contracts, no legacy debt growth.",
          "Isolated browser health check loaded the local app with content and no Next.js error overlay; the isolated session redirected to login, so an authenticated create could not be repeated there.",
          "npm run verify:fast -- --changed is blocked before lint by unrelated dirty-tree deletion app/venue/components/booking-calendar.tsx.",
          "Full npm run typecheck reports the repository's existing broad TypeScript debt; no focused lint or test failure points to this repair."
        ],
        "last_run_sha": "d21769046d517898144ee09a1c7bb4a7d36b068f",
        "last_run_at": "2026-09-24T06:36:18.000Z"
      },
      {
        "id": "hosted-product",
        "level": "hosted",
        "owner": "qa",
        "required_for": "product",
        "result": "not_run",
        "commands": [],
        "evidence": [
          "Transferred from the v1 task; this gate does not keep a locally complete domain implementation active."
        ],
        "last_run_sha": null,
        "last_run_at": null
      }
    ]
  },
  "progress": {
    "summary": "Repaired site-map creation and builder launch end to end: acting-organization requests cover Admin map clients, create response mounts editor independently of stale list/detail results, scope changes clear stale selection/deep links, and verified organization-owner writes use the resolved scope service client after capability and parent validation. Focused Vitest passed 54/54, focused ESLint and route registry passed, and agents:validate passed with 0 errors.",
    "completed": [
      "Routed Admin site-map clients and editor operations through the acting-organization request adapter while preserving JSON and multipart request behavior.",
      "Made the successful POST result authoritative for immediate builder mounting and protected it from stale list/detail responses.",
      "Cleared selected map, pending launch, create dialog, and stale deep links when organization/event/tour scope changes.",
      "Canonicalized Admin site-map links to tab=maps while preserving eventId/tourId/siteMapId.",
      "Changed the verified collection route to use the resolved scope service client after explicit capability and organization/event/tour validation, fixing organization-owner RLS insertion failures.",
      "Added an inline wizard error so server failures are visible above the Create & open builder action.",
      "Added behavioral and route tests covering the reported path and regressions."
    ],
    "next_steps": [
      "Follow the linked product verification gate; do not reopen this record."
    ],
    "blockers": [],
    "checkpoints": [
      {
        "at": "2026-09-24T06:37:42.576Z",
        "sha": "d21769046d517898144ee09a1c7bb4a7d36b068f",
        "summary": "Repaired site-map creation and builder launch end to end: acting-organization requests cover Admin map clients, create response mounts editor independently of stale list/detail results, scope changes clear stale selection/deep links, and verified organization-owner writes use the resolved scope service client after capability and parent validation. Focused Vitest passed 54/54, focused ESLint and route registry passed, and agents:validate passed with 0 errors.",
        "completed": [],
        "next_steps": [
          "Have the user refresh the authenticated Logistics page and retry Create & open builder; any remaining API failure is now displayed inline in the wizard with actionable details."
        ],
        "blockers": []
      }
    ]
  },
  "handoffs": [],
  "execution_state": "done",
  "outcome_id": "POSTLAUNCH-LOGISTICS",
  "deliverable_class": "implementation",
  "decision_owner": "admin",
  "shared_working_set": [],
  "depends_on": [],
  "resume_condition": "No further work on this record; use the recorded successor or product verification gate.",
  "blocked_on": []
}
