{
  "schema_version": "2.0",
  "id": "EVENTS-003",
  "title": "Reconcile event consumers from DB-008",
  "status": "blocked",
  "execution_state": "waiting_dependency",
  "priority": "P1",
  "owner_agent": "events",
  "outcome_id": "CORE-WEB-LAUNCH",
  "deliverable_class": "implementation",
  "decision_owner": "events",
  "created_at": "2026-09-27T19:59:08.554Z",
  "updated_at": "2026-09-27T19:59:08.554Z",
  "base_sha": "16fb834f1a03a70f165be470a5f98f389bf6100a",
  "working_tree_status": "dirty shared worktree; control-plane-only task creation",
  "goal": "Resolve event-reference and event-surface type drift without weakening consumer authorization.",
  "scope": {
    "in": [
      "Resolve event-reference and event-surface type drift without weakening consumer authorization."
    ],
    "out": [
      "Unrelated product work",
      "Hosted mutation unless explicitly owned",
      "Post-launch scope"
    ]
  },
  "working_set": [
    "app/api/events/**",
    "lib/events/**",
    "__tests__/events/**"
  ],
  "shared_working_set": [],
  "references": [
    "docs/engineering/PRODUCT_OUTCOMES.md",
    "docs/engineering/agents/events/CHARTER.md"
  ],
  "depends_on": [
    "DB-008",
    "EVENTS-001"
  ],
  "resume_condition": "All dependencies complete: DB-008, EVENTS-001.",
  "blocked_on": [
    {
      "type": "dependency",
      "owner": "events",
      "condition": "Complete DB-008, EVENTS-001.",
      "dependency_task_ids": [
        "DB-008",
        "EVENTS-001"
      ]
    }
  ],
  "acceptance_criteria": [
    {
      "id": "AC-1",
      "criterion": "Resolve event-reference and event-surface type drift without weakening consumer authorization.",
      "owner": "events",
      "state": "not_started",
      "evidence": []
    }
  ],
  "verification": {
    "tier": "fast",
    "gates": [
      {
        "id": "local",
        "level": "local",
        "owner": "events",
        "required_for": "task",
        "result": "not_run",
        "commands": [
          "npm run agents:validate -- --strict"
        ],
        "evidence": [],
        "last_run_sha": null,
        "last_run_at": null
      }
    ]
  },
  "progress": {
    "summary": "Created by the core-launch realignment; implementation has not started.",
    "completed": [],
    "next_steps": [
      "Wait for DB-008, EVENTS-001 and then confirm the working set is collision-free."
    ],
    "blockers": [
      "Waiting for DB-008, EVENTS-001."
    ],
    "checkpoints": []
  },
  "handoffs": []
}
